{
  "$schema": "https://json-schema.org/draft/2020-12/schema",
  "$id": "https://claude-skills/pptx-diagram/schemas/lifecycle.schema.json",
  "title": "Native PPTX Lifecycle Diagram",
  "description": "Structurally identical to the workflow schema (lanes/nodes/edges, same layout budget) -- use it for state machines instead of process flows. Convention: a 'main' lane for the happy-path states and a 'terminal' lane for end states, with node types start/active/waiting/success/failure.",
  "type": "object",
  "additionalProperties": false,
  "required": ["schema_version", "diagram_type", "meta", "lanes", "nodes", "edges"],
  "properties": {
    "schema_version": { "const": 1 },
    "diagram_type": { "const": "lifecycle" },
    "meta": {
      "type": "object",
      "additionalProperties": false,
      "required": ["title"],
      "properties": {
        "title": { "type": "string", "minLength": 1 },
        "subtitle": { "type": "string" },
        "output": { "type": "string" }
      }
    },
    "lanes": {
      "type": "array",
      "minItems": 1,
      "items": {
        "type": "object",
        "additionalProperties": false,
        "required": ["id", "label"],
        "properties": {
          "id": { "$ref": "common.schema.json#/$defs/id" },
          "label": { "type": "string", "minLength": 1 },
          "height": { "type": "number", "minimum": 1.2, "maximum": 3, "description": "inches; default 1.75" }
        }
      }
    },
    "nodes": {
      "type": "array",
      "minItems": 1,
      "items": {
        "type": "object",
        "additionalProperties": false,
        "required": ["id", "lane", "type", "label"],
        "properties": {
          "id": { "$ref": "common.schema.json#/$defs/id" },
          "lane": { "$ref": "common.schema.json#/$defs/id" },
          "col": { "type": "integer", "minimum": 0, "maximum": 5, "description": "slot index within the lane; auto-assigned to the next free slot if omitted" },
          "type": { "$ref": "common.schema.json#/$defs/nodeType" },
          "label": { "type": "string", "minLength": 1 },
          "sublabel": { "type": "string" },
          "tag": { "type": "string" },
          "width": { "type": "number", "minimum": 0.6, "maximum": 1.85, "description": "inches; default 1.8, capped so it never exceeds one slot" },
          "height": { "type": "number", "minimum": 0.5, "maximum": 1.5, "description": "inches; default 0.95" }
        }
      }
    },
    "edges": {
      "type": "array",
      "items": {
        "type": "object",
        "additionalProperties": false,
        "required": ["from", "to"],
        "properties": {
          "from": { "$ref": "common.schema.json#/$defs/id" },
          "to": { "$ref": "common.schema.json#/$defs/id" },
          "label": { "type": "string" },
          "variant": { "enum": ["default", "emphasis", "security", "dashed"] },
          "route": { "$ref": "common.schema.json#/$defs/route" },
          "bias": { "type": "number", "minimum": 0.1, "maximum": 0.9 }
        }
      }
    },
    "cards": {
      "type": "array",
      "items": {
        "type": "object",
        "additionalProperties": false,
        "required": ["title", "items"],
        "properties": {
          "title": { "type": "string", "minLength": 1 },
          "color": { "$ref": "common.schema.json#/$defs/hexColor" },
          "items": { "type": "array", "items": { "type": "string" } }
        }
      }
    }
  }
}
